ref;name;base;damage;range;effect
1;TAIL ATTACK;10;2;1;The beast swipes its tail against an adventurer within `NEAR` range. Roll for the attack with __**ten** Base Dice and Weapon Damage **2** (blunt force)__. If the attack hits, the adventurer is thrown to the ground.
2;DEVOURING ATTACK;8;1;0;The Sea Serpent tries to devour the adventurer with the highest `STRENGTH` score. Roll for the attack with __**eight** Base Dice and Weapon Damage **1** (slash wound)__. If hit, the victim is swallowed whole and suffers one point of damage every round inside the creature’s belly. The adventurer can attack the beast from the inside, where the Sea Serpent has no armor. The victim can escape once the Sea Serpent is dead.
3;WILD BITE;10;2;1;The creature bites an adventurer within `NEAR` range. Roll for the attack with __**ten** Base Dice and Weapon Damage **2** (slash wound)__.
4;DROWN ATTACK;8;2;1;The beast attacks an adventurer within `NEAR` range and pulls her into the deep. Roll for the attack with __**eight** Base Dice and Weapon Damage **2** (slash wound)__. If the attack succeeds, the adventurer is `GRAPPLED` and pulled under. See the rules for drowning on page 113 of the Player’s Handbook.
5;CRUSHING ATTACK;9;1;1;The beast rises above the surface of the water and then lets its heavy body fall onto two adventurers within `NEAR` range. Roll for the attacks with __**nine** Base Dice and Weapon Damage **1** (blunt force)__. Any victims hit are thrown to the shattered deck or even into the watery depths.
6;DEATHLY EMBRACE;11;2;1;The Sea Serpent ensnares an adventurer within `NEAR` range with its tail and tries to squeeze the life out of her. Roll for the attack with __**eleven** Base Dice and Weapon Damage **2** (blunt force)__. If the attack hits, the victim is `GRAPPLED` and must endure the same attack in each subsequent round (this does not count as an attack for the beast).