ref;name;base;damage;range;effect
1;RENDING ATTACK;8;1;0;The Nightwarg leaps forward, tearing at an adventurer using its sharp claws. The victim is attacked using __**eight** Base Dice and Weapon Damage **1** (slash wound)__.
2;VIOLENT BITE;7;2;0;With a growl, the Nightwarg jumps at the nearest adventurer, biting him using all its strength. Perform an attack using __**seven** Base Dice and Weapon Damage **2** (slash wound)__. If succesful the adventurer become `COLD`. The attack can be `PARRIED`.
3;DEATH RATTLE;7;1;0;The Nightwarg jumps at an adventurer, biting it, and then shakes the unfortunate victim, finally throwing the victim aside like a rag doll. Roll for the attack using __**seven** Base Dice and Weapon Damage **1** (slash wound)__. If the attack hits, the victim is thrown to a `NEAR` distance and lands prone.
4;LEAPING ATTACK;8;1;0;The Nightwarg rushes forward and jumps at one of the adventurers with all its might. Roll for the attack using __**eight** Base Dice and Weapon Damage **1** (slash wound)__. If the attack is successful, the victim is thrown to the ground and the Nightwarg immediately performs an extra attack (__**six** Base Dice and Weapon Damage **2**, slash wound__), outside of the normal turn order. The extra attack **cannot** be `DODGED`.
5;LOCKED JAW;7;2;0;The Nightwarg bites the arm or leg of one of the adventurers and locks its jaws in a brutal grip. Roll for the attack using __**seven** Base Dice and Weapon Damage **2** (blunt force)__. If hit, the adventurer is `GRAPPLED`.
6;THROAT BITE;10;2;0;The Nightwarg sees a weak spot and attacks the adventurer by biting her in the throat, trying to kill her. Roll for the attack using __**ten** Base Dice and Weapon Damage **2** (slash wound)__. The attack may be `PARRIED`. The adventurer suffers half of the amount of damage (round up) to `EMPATHY` as well, due to the horrific encounter and become `COLD`.