ref;name;base;damage;range;effect
1;KLAUENANGRIFF;10;2;1;Der Drache schlägt mit den Klauen gegen zwei Abenteurer in `NAHER` Reichweite. Führe gegen jeden einen Angriff mit __**10** Basiswürfeln und Waffenschaden **2** (Schnittwunde)__ aus.
2;SCHNEESTURM;8;1;1;Der Frostdrache öffnet das Maul und atmet eine Wolke aus Eis und Schnee aus. Führe gegen alle in `NAHER` Reichweite einen Angriff mit __**8** Basiswürfeln und Waffenschaden **1**__ gegen `GESCHICKLICHKEIT` (nicht Stärke) aus. Alle Abenteurer, die Schaden nehmen, sind auch `UNTERKÜHLT`. Diesem Angriff kann man nicht `AUSWEICHEN`.
3;MIT DEN FLÜGELN SCHLAGEN;6;1;1;Der Frostdrache schlägt mit den riesigen Flügeln und beschwört einen Wirbelsturm herauf. Führe gegen Abenteurer in `NAHER` Reichweite einen Angriff mit __**6** Basiswürfeln und Waffenschaden **1** (Stumpfer Schlag)__ aus. Dem Angriff kann man nicht `AUSWEICHEN` und alle Opfer werden zu Boden geworfen.
4;BRUTALER BISS;12;2;0;Die Bestie nähert sich dem am wenigsten geschützten Ziel und versucht, es zu verschlingen. Führe einen Angriff mit __**12** Basiswürfeln und Waffenschaden **2** (Stichwunde)__ aus.
5;SCHWANZFEGER;8;1;1;Der Frostdrache fegt mit dem Schwanz alle Gegner in `NAHER` Reichweite weg. Führe gegen jedes Ziel einen Angriff mit __**8** Basiswürfeln und Waffenschaden **1** (Schnittwunde)__ aus. Alle, die getroffen werden, werden zu Boden geworfen.
6;EISKALTER ATEM;12;1;2;Der Frostdrache baut sich vor einer Abenteurerin in `KURZER` Reichweite auf und stößt einen vernichtend kalten Schneesturm aus. Führe einen Angriff mit __**12** Basiswürfeln und Waffenschaden **1**__ aus. Nimmt das Opfer Schaden, ist es `UNTERKÜHLT`. Wird das Opfer durch diesen Angriff `GEBROCHEN`, gefriert es und ist augenblicklich tot.