ref;name;base;damage;range;effect
1;ECHOLOT;;;3;Der Drescher verschafft sich einen Eindruck von seiner Umgebung, indem er einen kurzen Schallimpuls abgibt. Der nächste Wurf auf diese Tabelle erhält **+1**. Durch das schrille Kreischen erhöht sich der `STRESSLEVEL` aller SC auf `WEITE` Entfernung um **1**.
2;SONARIMPULS;;;1;Der Drescher nutzt seine Echoortung als Waffe und stößt einen starken Schallimpuls aus. Alle Charaktere innerhalb von `KURZER` Entfernung müssen einen erfolgreichen Wurf auf `AUSDAUER` ablegen (erfordert keine Aktion), um nicht betäubt zu werden und die nächste Aktion zu verlieren. Gelingt der Wurf, muss das Ziel trotzdem einen __Panikwurf__ ablegen.
3;STURMANGRIFF;10;1;0;Der in die Ecke gedrängte Drescher stürmt in wilder Raserei auf den SC zu, den er als größte Bedrohung empfindet. Die Kreatur bewegt sich in eine benachbarte Zone und versucht dabei, das Ziel niederzutrampeln sowie jeden, der sich auf seinem Weg befindet. Alle betroffenen Charaktere müssen einen erfolgreichen Wurf auf `BEWEGLICHKEIT` ablegen (erfordert keine Aktion), um aus dem Weg zu springen. Wem der Wurf nicht gelingt, erleidet einen Angriff mit __**10** Basiswürfeln (Basisschaden **1**)__ und wird zu Boden geworfen.
4;STAMPEDE;6;2;1;Der Drescher wird rasend vor Wut und tritt im wahnsinnigen Rausch um sich. Alle Charaktere in `KURZER` Entfernung erleiden einen Angriff mit __**6** Basiswürfeln (Basisschaden **2**)__ und werden bei einem Treffer zu Boden geworfen.
5;GRABENDE KLAUEN;10;2;0;Mit seinen furchteinflößenden Klauen wühlt sich der Drescher ebenso mühelos durch Fleisch und Knochen wie durch Erde und Stein. Greife ein Ziel mit __**10** Basiswürfeln an (Basisschaden **2**)__.
6;PULVERISIEREN;10;;0;Der Drescher zieht ein Opfer in seinen schrecklichen rotierenden Schlund. Das Ziel kann einen letzten vergleichenden Wurf auf `NAHKAMPF` gegen __**8** Basiswürfel__ ablegen (erfordert keine Aktion), um seinem grauenvollen Schicksal zu entgehen. Misslingt der Wurf, wird der Körper des Opfers gnadenlos zerrissen und zermahlen. Jeder Charakter, der den qualvollen Tod seines Freundes miterlebt, erhält `STRESSLEVEL` **+1** und muss einen __Panikwurf__ ablegen.