ref;name;base;damage;range;crit;effect
1;RETREAT;;;;;The Scorpionid isn’t stupid and won’t fight unless there’s a good reason to. On this occasion it decides to flee the fight as quickly as possible.
2;PINNED DOWN;10;1;0;;The Scorpionid uses its powerful pincers to pin down its target. Roll for the attack using __**ten** Base Dice, Damage **1**__. If the attack hits, the target is knocked prone, drops any hand-held items and must make an immediate __Panic Roll__.
3;PINCER GRAB;8;1;0;;The creature tries to seize its victim in its enormous claws, quivering with the anticipation of a quick strike with its huge tail. Roll for the attack with __**eight** Base dice, Damage **1**__. If the attack hits, the victim is grappled (see page 93) and must make an opposed roll for `CLOSE COMBAT` against **eight** Base Dice to break loose. If the Scorpionid retains its grasp, it will automatically make a **TAIL STRIKE** (n°4) attack against the victim on its next initiative. If this attack hits underwater the Scorpionid will drag the victim deeper and one zone away from the group, causing them to also suffer the effects of **drowning**.
4;FLAILING STRIKE;8;1;0;true;The Scorpionid’s pincer swipes at its target. Roll for the attack with __**eight** Base dice, Damage **1**__. If the attack hits, the Scorpionid flings the victim into the next zone, causing an immediate __critical injury__ (regardless if the victim is Broken). The victim is left prone and drops any hand-held items.
5;TAIL STRIKE;10;1;0;;The Scorpionid swings its terrible tail forward with deadly purpose. It attacks with __**ten** Base Dice, Damage **1**__. If it inflicts any damage it poisons the victim with a deadly venom, counting as a disease with a **Virulence rating of 9** (see page 109).
6;IMMOBILIZE;8;2;0;35;The Scorpionid wants to escape, but to do so it needs to take its attackers out of the fight. It lunges for its victim’s legs with its huge claws, making an attack with __**eight** Base Dice, Damage **2**__. If it does any damage, the victim immediately suffers __critical injury **#35**__, whether or not they are Broken.