ref;name;base;damage;range;crit;effect
1;BEDROHUNG EINSCHÄTZEN;;;2;;Der Xenomorph hält inne und zischt leise, aber umso bedrohlicher. Er sieht aus, als würde er nachdenken oder seinen nicht sichtbaren Gefährten lautlose Anweisungen geben. Der `STRESSLEVEL` jedes Gegners, der sich innerhalb von `MITTLERER` Entfernung und in Sichtlinie zum Xenomorph befindet, steigt um **1**.
2;EINER FÜR ALLE;;;1;;Der Xenomorph springt auf die größte Gruppe von Feinden zu, brüllt herausfordernd und schlägt wild mit Armen, Beinen und Schwanz um sich. Allen Zielen innerhalb von `KURZER` Entfernung muss ein Wurf auf `BEWEGLICHKEIT` gelingen, um nicht zu Boden geworfen zu werden und 1 Schadenspunkt zu erleiden. Zusätzlich muss jedes Ziel sofort einen __Panikwurf__ ablegen.
3;VOLLER ANGRIFF;12;2;0;;Der Xenomorph stürmt vor und attackiert ein Opfer erbarmungslos mit Klauen, Zähnen und Schwanz. Greife mit __**12** Basiswürfeln an (Basisschaden **2**)__. Der Angriff gilt als panzerbrechend (nur halbierter Panzerungswert zählt).
4;FANGEN FÜR DIE BRUTSTÄTTE;12;(1);0;;Der Xenomorph attackiert ein Opfer mit seinem stachelbewehrten Schwanz, um ihm ein __lähmendes Gift__ zu injizieren. Greife mit __**12** Basiswürfeln an (Basisschaden **1**)__. Führt der Angriff zum Verlust von Gesundheitspunkten, hält sich die Kreatur zurück und verursacht nur 1 Schadenspunkt, doch das Gift gerät in den Blutkreislauf. Das Ziel muss einen Wurf auf `AUSDAUER` ablegen: Die gewürfelten ~success entsprechen der Anzahl von Runden, die es sich wach halten kann, bevor es für die Dauer von einer Schicht das Bewusstsein verliert. Die Lähmung kann mit einer Adrenalinspritze aufgehoben werden (Wurf auf `MEDIZINISCHE HILFE` unter Verwendung eines MedKits).
5;FÜR DIE KÖNIGIN;12;;1;;In dem verzweifelten Versuch, Brutstätte und Königin zu beschützen, wirft sich der Xenomorph auf seine Feinde und weidet sich dabei selbst aus. Sein Säureblut spritzt durch die Luft: Alle Ziele in `KURZER` Entfernung erleiden einen sofortigen __Säurespritzer-Angriff mit **12** Basiswürfeln__. **Die Kreatur verendet** kreischend.
6;KOPFBISS;10;2;0;64;Der Xenomorph hält den Schädel eines Opfers mit unerbittlicher Gewalt gepackt, während sich sein innerer Kiefer zähnefletschend vorschiebt — und schließlich zuschnappt. Greife mit __**10** Basiswürfeln an (Basisschaden **2**)__. Führt der Angriff zum Verlust von Gesundheitspunkten, erleidet das Ziel automatisch die __kritische Verletzung **#64**__ (auch wenn es nicht außer Gefecht gesetzt ist), was es sofort tötet.